<?xml version="1.0" encoding="UTF-8"?>
<jmapper
xmlns="https://jmapper-framework.googlecode.com"
xmlns:xsi="https://jmapper-framework.googlecode.com/svn"
xsi:noNamespaceSchemaLocation="jmapper.xsd">
  <class name="com.googlecode.jmapper.integrationtest.conversions.bean.DExplicitConversion">
   <attribute name="field">
      <value name="field"/>
    </attribute>
    <conversion name="conversion">
      	return ${source} + " explicit XML converted"; 
    </conversion>
  </class>
  <class name="com.googlecode.jmapper.integrationtest.conversions.bean.SExplicitRecursive">
    <attribute name="sconversion">
      <value name="dconversion"/>
    </attribute>
  </class>
</jmapper>