<?xml version="1.0" encoding="UTF-8"?>
<jmapper
xmlns="https://jmapper-framework.googlecode.com"
xmlns:xsi="https://jmapper-framework.googlecode.com/svn"
xsi:noNamespaceSchemaLocation="https://jmapper-framework.googlecode.com/svn/jmapper.xsd">
  <class name="com.googlecode.jmapper.integrationtest.configurations.bean.JGlobalMapD">
    <global>
    	<excluded>
    	   <attribute name ="field3"/>
    	</excluded>
    </global>
  </class>
  <class name="com.googlecode.jmapper.integrationtest.configurations.bean.JGlobalMapD2">
    <global>
    	<excluded>
    	   <attribute name ="field3"/>
    	</excluded>
    </global>
    <attribute name="field3">
      <value name="field3"/>
    </attribute>
  </class>
  <class name="com.googlecode.jmapper.integrationtest.configurations.bean.JGlobalMapD6">
    <global>
    	<excluded>
    	   <attribute name ="field2"/>
    	</excluded>
    	<classes>
    	   <class name="com.googlecode.jmapper.integrationtest.configurations.bean.JGlobalMapS2"/>
    	</classes>
    </global>
    <attribute name="field2">
      <value name="field2"/>
      <classes>
    	 <class name="com.googlecode.jmapper.integrationtest.configurations.bean.JGlobalMapS"/>
      </classes>
    </attribute>
  </class>
  <class name="com.googlecode.jmapper.integrationtest.configurations.bean.JGlobalMapD3">
    <global>
    	<excluded>
    	   <attribute name ="field3"/>
    	</excluded>
    </global>
    <attribute name="field2">
      <value name="notUsed"/>
    </attribute>
  </class>
</jmapper>