<?xml version="1.0" encoding="UTF-8"?>
<jmapper
xmlns="https://jmapper-framework.googlecode.com"
xmlns:xsi="https://jmapper-framework.googlecode.com/svn"
xsi:noNamespaceSchemaLocation="jmapper.xsd">

   <class name="com.googlecode.jmapper.integrationtest.conversions.bean.ObjSecondD">
    <attribute name="fieldSecondD">
      <value name="fieldSecondS"/>
    </attribute>
    <conversion name="conversion">
      	return new com.googlecode.jmapper.integrationtest.conversions.bean.ObjThirdD(${destination}.getFieldThirdD() + " XML " + ${source}.getFieldThirdS()); 
    </conversion>
  </class>
  <class name="com.googlecode.jmapper.integrationtest.conversions.bean.ObjFirstD">
    <attribute name="fieldFirstD">
      <value name="fieldFirstS"/>
    </attribute>
  </class>
</jmapper>