<?xml version="1.0" encoding="UTF-8"?>
<jmapper
xmlns="https://jmapper-framework.googlecode.com"
xmlns:xsi="https://jmapper-framework.googlecode.com/svn"
xsi:noNamespaceSchemaLocation="jmapper.xsd">
  <class name="com.googlecode.jmapper.bean.StaticD">
    <attribute name="startDate">
      <value name="startDate"/>
    </attribute>
    <attribute name="endDate">
      <value name="endDate"/>
    </attribute>
  </class>
  <class name="com.googlecode.jmapper.bean.StaticS">
    <conversion name="toDate">
    	return new java.text.SimpleDateFormat("MM/dd/yyyy").parse(${source});
    </conversion>
  </class>
</jmapper>
